token_id,query,metaphor,pos,fgpos,sentence,local
ecv-fragment05_1214_27,interpreted,1.0,VERB,VBN,The trouble with all the views which we have looked at is that they tie the notion of autonomy firmly and solely to that of knowledge interpreted in either a broad or narrow sense .,The trouble with all the views which we have looked at is that they tie the notion of autonomy firmly and solely to that of knowledge interpreted in either a broad or narrow sense .
ecv-fragment05_1215_23,denied,0.0,VERB,VBN,That it is firmly tied must be correct ; the inhabitants of Brave New World are not autonomous precisely because they are denied access to relevant information .,That it is firmly tied must be correct ; the inhabitants of Brave New World are not autonomous precisely because they are denied access to relevant information .
ecv-fragment05_1217_2,said,1.0,VERB,VBD,Aristotle said something very interesting in that extract from the Politics which I quoted earlier ; he said that women have a deliberative faculty but that it lacks full authority .,Aristotle said something very interesting in that extract from the Politics which I quoted earlier ; he said that women have a deliberative faculty but that it lacks full authority .
ecv-fragment05_1217_18,said,1.0,VERB,VBD,Aristotle said something very interesting in that extract from the Politics which I quoted earlier ; he said that women have a deliberative faculty but that it lacks full authority .,Aristotle said something very interesting in that extract from the Politics which I quoted earlier ; he said that women have a deliberative faculty but that it lacks full authority .
ecv-fragment05_1217_28,lacks,0.0,VERB,VBZ,Aristotle said something very interesting in that extract from the Politics which I quoted earlier ; he said that women have a deliberative faculty but that it lacks full authority .,Aristotle said something very interesting in that extract from the Politics which I quoted earlier ; he said that women have a deliberative faculty but that it lacks full authority .
faj-fragment17_1647_2,bounces,0.0,VERB,VBZ,It bounces alarmingly as it gathers speed .,It bounces alarmingly as it gathers speed .
faj-fragment17_1648_16,turns,1.0,VERB,VBZ,"A few Africans , clutching sticks and wearing skins , watch the plane as it turns , pauses , and then accelerates , leaving a cloud of dust .",watch the plane as it turns 
faj-fragment17_1648_18,pauses,1.0,NOUN,NNS,"A few Africans , clutching sticks and wearing skins , watch the plane as it turns , pauses , and then accelerates , leaving a cloud of dust .",pauses 
faj-fragment17_1661_15,preparing,1.0,VERB,VBG,"It dips its wings in acknowledgement of the landing strip , and circles , preparing to land .",preparing to land .
faj-fragment17_1663_2,checks,0.0,VERB,VBZ,She checks her appearance in a mirror hanging on a tree .,She checks her appearance in a mirror hanging on a tree .
faj-fragment17_1667_6,pursued,0.0,VERB,VBN,"The plane is taxiing , pursued by a group of running Masai warriors , glorious in their red and purple robes , ochred hair , lion head-dresses and so on .",pursued by a group of running Masai warriors 
faj-fragment17_1671_3,securing,0.0,VERB,VBG,Fairfax is securing its wheels with rocks .,Fairfax is securing its wheels with rocks .
faj-fragment17_1678_4,approach,0.0,VERB,VBP,Claudia and Fairfax approach each other .,Claudia and Fairfax approach each other .
faj-fragment17_1682_4,come,0.0,VERB,VB,Claudia and Fairfax come closer .,Claudia and Fairfax come closer .
faj-fragment17_1684_4,surprised,1.0,VERB,VBN,He is perhaps surprised by her composure .,He is perhaps surprised by her composure .
faj-fragment17_1699_5,surrounds,0.0,VERB,VBZ,The throng of Masai surrounds them .,The throng of Masai surrounds them .
faj-fragment17_1719_5,see,0.0,VERB,VBP,As she speaks we see a Masai market .,As she speaks we see a Masai market .
faj-fragment17_1723_5,accompanied,1.0,VERB,VBN,"Almost every man is accompanied by a goat or a cow , held on a short leather thong or controlled by a thin stick .",Almost every man is accompanied by a goat or a cow 
faj-fragment17_1729_5,wear,0.0,VERB,VBP,On their heads they wear fezes .,On their heads they wear fezes .
faj-fragment17_1733_14,contributing,0.0,VERB,VBG,He had to collect the cattle and make sure that every boma was contributing his fair share .,He had to collect the cattle and make sure that every boma was contributing his fair share .
faj-fragment17_1743_5,scarred,0.0,VERB,VBN,He is still vividly scarred from his recent encounter with a lion .,He is still vividly scarred from his recent encounter with a lion .
faj-fragment17_1765_11,hurls,0.0,VERB,VB,"As they move forward , Tepilit , without warning , hurls his spear at the district officer from a few feet away .",hurls his spear at the district officer from a few feet away .
faj-fragment17_1769_7,pours,0.0,NOUN,NNS,"A fountain of blood at first pours from his chest , but soon subsides become a steady trickle .",A fountain of blood at first pours from his chest 
faj-fragment17_1769_18,trickle,0.0,NOUN,NN,"A fountain of blood at first pours from his chest , but soon subsides become a steady trickle .",but soon subsides become a steady trickle .
faj-fragment17_1771_2,drives,0.0,VERB,VBZ,This drives the spear almost completely through his body .,This drives the spear almost completely through his body .
faj-fragment17_1776_2,cock,1.0,VERB,VBP,They cock their rifles and fire into the air .,They cock their rifles and fire into the air .
faj-fragment17_1777_3,guard,0.0,VERB,VBP,"Now they guard the body , which is motionless in a lake of blood that is rapidly drying , drunk by the thirsty , insatiable soil .",Now they guard the body 
faj-fragment17_1777_18,drying,1.0,VERB,VBG,"Now they guard the body , which is motionless in a lake of blood that is rapidly drying , drunk by the thirsty , insatiable soil .",which is motionless in a lake of blood that is rapidly drying 
faj-fragment17_1779_2,drives,0.0,VERB,VBZ,Tepilit drives his bull away .,Tepilit drives his bull away .
faj-fragment17_1782_6,mount,0.0,VERB,VB,This little group begins to mount a hill .,This little group begins to mount a hill .
faj-fragment17_1788_6,presented,0.0,VERB,VBD,‘ The next day he presented himself for arrest . ’,‘ The next day he presented himself for arrest . ’
faj-fragment17_1793_7,give,0.0,VERB,VB,‘ And you told him to give himself up ? ’,‘ And you told him to give himself up ? ’
faj-fragment17_1802_5,arranged,0.0,VERB,VBN,‘ It 's not arranged yet .,‘ It 's not arranged yet .
faj-fragment17_1823_4,take,1.0,VERB,VB,‘ Shall we take some coffee now ? ’,‘ Shall we take some coffee now ? ’
faj-fragment17_1826_3,worry,1.0,VERB,VB,Do n't worry . ’,Do n't worry . ’
faj-fragment17_1829_17,forming,0.0,VERB,VBG,In front of the building is a row of white-painted stones and some cactus-like sisal plants forming a circle around a patch of grass .,In front of the building is a row of white-painted stones and some cactus-like sisal plants forming a circle around a patch of grass .
faj-fragment17_1839_11,holding,1.0,VERB,VBG,I want to talk to the Masai man you are holding .,I want to talk to the Masai man you are holding .
faj-fragment17_1848_2,Stand,0.0,VERB,VB,‘ Stand up man .,‘ Stand up man .
faj-fragment17_1876_4,fought,0.0,VERB,VBD,‘ Your people fought very bravely . ’,‘ Your people fought very bravely . ’
faj-fragment17_1877_5,brave,0.0,ADJ,JJ,‘ The Masai are brave . ’,‘ The Masai are brave . ’
faj-fragment17_1890_7,regain,0.0,VERB,VB,It takes him a moment to regain his composure .,It takes him a moment to regain his composure .
faj-fragment17_1904_2,took,0.0,VERB,VBD,"He took my best animal , even though I offered two in its place .",He took my best animal 
faj-fragment17_1906_18,take,0.0,VERB,VB,"And now my family have offered forty-nine cattle to his family , but the government will not take them to give to his family in England . ’",but the government will not take them to give to his family in England . ’
faj-fragment17_1919_15,defend,0.0,VERB,VB,I can say to the governor that you misunderstood the order and tried to defend yourself .,I can say to the governor that you misunderstood the order and tried to defend yourself .
faj-fragment17_1920_28,pointed,0.0,VERB,VBD,"Not the district officer 's order , but the translator 's who spoke too fast without proper consideration , as Nandi people do , and the askaris pointed their guns at you .",and the askaris pointed their guns at you .
faj-fragment17_1923_8,fine,0.0,VERB,VB,If I tell him that they will fine you .,If I tell him that they will fine you .
faj-fragment17_1925_11,took,0.0,VERB,VBD,They know that I killed him on purpose because he took my best animal . ’,They know that I killed him on purpose because he took my best animal . ’
faj-fragment17_1926_12,kill,0.0,VERB,VB,"‘ If you say that at your trial , they will kill you . ’",they will kill you . ’
faj-fragment17_1929_2,stands,0.0,VERB,VBZ,Fairfax stands up .,Fairfax stands up .
faj-fragment17_1932_2,Go,0.0,VERB,VB,‘ Go in peace . ’,‘ Go in peace . ’
faj-fragment17_1934_4,stand,0.0,VERB,VB,Tepilit does not stand up .,Tepilit does not stand up .
faj-fragment17_1941_2,admits,1.0,VERB,VBZ,He admits killing the DO .,He admits killing the DO .
faj-fragment17_1947_4,taken,1.0,VERB,VBN,‘ Was it taken down by a policeman ? ’,‘ Was it taken down by a policeman ? ’
faj-fragment17_1951_8,got,0.0,VERB,VBD,"‘ No , sir , but we got the Larusa translator in .",but we got the Larusa translator in .
faj-fragment17_1958_10,bouncing,0.0,VERB,VBG,"Fairfax 's car appears , the lights hopping and bouncing down the track .",the lights hopping and bouncing down the track .
faj-fragment17_1959_2,rises,0.0,VERB,VBZ,Claudia rises .,Claudia rises .
faj-fragment17_1978_18,considered,0.0,VERB,VBN,"Claudia , the problem is that one Masai , cruel as this may sound , is not considered very important .",is not considered very important .
faj-fragment17_1979_7,cadged,0.0,VERB,VBN,I have flown my plane with cadged army fuel six hundred miles .,I have flown my plane with cadged army fuel six hundred miles .
faj-fragment17_1998_11,sweeping,0.0,VERB,VBG,Around them graceful Masai women in long leather skirts are sweeping the boma and plastering the huts with cow dung .,Around them graceful Masai women in long leather skirts are sweeping the boma and plastering the huts with cow dung .
faj-fragment17_2008_2,give,0.0,VERB,VBP,We give them our cows .,We give them our cows .
faj-fragment17_2014_4,wants,0.0,VERB,VBZ,But the government wants to take away my son also .,But the government wants to take away my son also .
faj-fragment17_2026_11,indicate,0.0,VERB,VB,"He turns his old head wearily , as if to indicate to his family the kind of people he has to deal with these days .",as if to indicate to his family the kind of people he has to deal with these days .
faj-fragment17_2051_1,Hanged,0.0,VERB,VBN,"Hanged like a chicken by his neck , in town . ’",Hanged like a chicken by his neck 
faj-fragment17_2058_5,save,0.0,VERB,VB,‘ How can Fahfakhs save him ?,‘ How can Fahfakhs save him ?
faj-fragment17_2065_2,grasps,0.0,VERB,VBZ,Fairfax grasps the old man by his wrist .,Fairfax grasps the old man by his wrist .
faj-fragment17_2074_2,rises,0.0,VERB,VBZ,Claudia rises .,Claudia rises .
faj-fragment17_2078_2,Go,0.0,VERB,VB,‘ Go in peace . ’,‘ Go in peace . ’
faj-fragment17_2080_3,stands,0.0,VERB,VBZ,The laibon stands to watch them go .,The laibon stands to watch them go .
faj-fragment17_2080_7,go,0.0,VERB,VB,The laibon stands to watch them go .,The laibon stands to watch them go .
faj-fragment17_2090_5,get,1.0,AUX,VB,I will try to get him off .,I will try to get him off .
faj-fragment17_2098_20,driven,0.0,VERB,VBN,"They drive down into a dry watercourse and are surrounded by hundreds of cattle returning from their grazing , driven by children and young warriors .",driven by children and young warriors .
faj-fragment17_2099_6,allow,0.0,VERB,VB,They cut the engine to allow the animals to pass undisturbed .,They cut the engine to allow the animals to pass undisturbed .
faj-fragment17_2101_10,strikes,0.0,VERB,VBZ,"A child greets her , but a young warrior strikes the child with a stick .",but a young warrior strikes the child with a stick .
faj-fragment17_2103_2,turns,0.0,VERB,VBZ,Fairfax turns to her .,Fairfax turns to her .
faj-fragment17_2107_2,sit,0.0,VERB,VBP,They sit in the dust of the vanished cattle .,They sit in the dust of the vanished cattle .
kb7-fragment31_11188_3,got,1.0,VERB,VBN,I 've got time ?,I 've got time ?
kb7-fragment31_11211_5,go,0.0,VERB,VB,Ha it wo n't go more than that !,Ha it wo n't go more than that !
kb7-fragment31_11213_7,go,0.0,VERB,VB,Yeah but perhaps it wo n't go more than that .,Yeah but perhaps it wo n't go more than that .
kb7-fragment31_11237_74,reckon,0.0,VERB,VBP,"packing Friday on the way to mum Peter 's mum she told them she 's just in so much pain , she wants it doing so he 's gon na get in , I said , it 's poss that she 'll be in six days and probably off a few weeks after when she gets home it 's operation on her neck and shoulder they 're going to release the nerve they reckon it 's it 's a she told them and do what they will with it .",it 's poss that she 'll be in six days and probably off a few weeks after when she gets home it 's operation on her neck and shoulder they 're going to release the nerve they reckon it 's it 's a she told them and do what they will with it .
kb7-fragment31_11243_26,look,1.0,VERB,VB,"Shame about that bungalow next door but one , cos that 'd be a nice bungalow but it 's not very lovely they do n't look after it very well .",cos that 'd be a nice bungalow but it 's not very lovely they do n't look after it very well .
kb7-fragment31_11245_22,go,0.0,VERB,VB,Got a wardrobe like ours and then oh no it is n't it 's a combination one it 's having to go up through the window let's hope they do n't drop it !,Got a wardrobe like ours and then oh no it is n't it 's a combination one it 's having to go up through the window let's hope they do n't drop it !
kb7-fragment31_11261_3,assembled,1.0,VERB,VBD,Cos Rita assembled it for us .,Cos Rita assembled it for us .
kb7-fragment31_11266_7,fell,0.0,VERB,VBD,"It would n't be if it fell , would it !",It would n't be if it fell 
kb7-fragment31_11280_9,call,1.0,VERB,VBP,What time of day do you think you call this !,What time of day do you think you call this !
kb7-fragment31_11290_5,got,0.0,VERB,VBD,He 's just about got it,He 's just about got it
kb7-fragment31_11291_4,got,0.0,VERB,VBN,Yeah they 've got it,Yeah they 've got it
kb7-fragment31_11324_3,get,0.0,AUX,VB,Ca n't get through ?,Ca n't get through ?
kb7-fragment31_11349_14,see,0.0,VERB,VB,"You do n't look well , you 're not right , I can see , cos you do n't look well .",I can see 
kb7-fragment31_11356_16,get,0.0,AUX,VB,"You know , I do n't feel myself anyway I ca n't I ca n't get through to anyway I 'll try so it does n't matter .",I do n't feel myself anyway I ca n't I ca n't get through to anyway I 'll try so it does n't matter .
kb7-fragment31_11358_10,drop,1.0,VERB,VB,"town I shall go around there , you can drop me and I 'll make an appointment there while we 're there .",you can drop me and I 'll make an appointment there while we 're there .
kb7-fragment31_11359_4,getting,1.0,VERB,VBG,Well it 's getting up there .,Well it 's getting up there .
kb7-fragment31_11363_9,keep,1.0,VERB,VB,"does n't matter I 'll , I 'll keep phoning .",I 'll keep phoning .
kb7-fragment31_11372_16,go,0.0,VERB,VBP,"She said you 'd be the I mean , and family when Wendy and that go and er she they had to with a la carte , oh it cost her a bomb !",and family when Wendy and that go and er she they had to with a la carte 
kb7-fragment31_11389_5,see,0.0,NOUN,NN,we 'd pop in see how you were and,we 'd pop in see how you were and
kb7-fragment31_11391_1,See,0.0,VERB,VB,See if you want anything up town .,See if you want anything up town .
kb7-fragment31_11409_13,make,0.0,VERB,VB,"Well yeah , no I 've light bulbs I mean I could make you a list down but it does n't matter I can get that tomorrow Ann I 'll go down tomorrow you know , I 'll be up in time .",no I 've light bulbs I mean I could make you a list down but it does n't matter I can get that tomorrow Ann I 'll go down tomorrow you know 
kb7-fragment31_11409_31,go,1.0,VERB,VB,"Well yeah , no I 've light bulbs I mean I could make you a list down but it does n't matter I can get that tomorrow Ann I 'll go down tomorrow you know , I 'll be up in time .",no I 've light bulbs I mean I could make you a list down but it does n't matter I can get that tomorrow Ann I 'll go down tomorrow you know 
kb7-fragment31_11418_13,make,0.0,VERB,VB,"I ca n't I ca n't really think I 'll have to make a list out you know but er you know I got just think of anything that 's , you know as I say I 've got got some cat food will get some dry cat food yeah Oh I if I start thinking I 'll I 'll I 'll",I ca n't I ca n't really think I 'll have to make a list out you know but er you know I got just think of anything that 's 
kb7-fragment31_11419_4,got,0.0,VERB,VBD,"Start thinking , got nothing lose , start",got nothing lose 
kb7-fragment31_11419_6,lose,0.0,VERB,VB,"Start thinking , got nothing lose , start",got nothing lose 
kb7-fragment31_11420_1,Make,0.0,VERB,VB,"Make a list , I 'll get it for you .",Make a list 
kb7-fragment31_11425_4,save,1.0,VERB,VB,"Save you , save you carrying them .",save you carrying them .
kb7-fragment31_11427_15,mean,0.0,VERB,VBP,"no I 'm alright Ann , I mean , feel a bit ah I mean I 'm sorry I do have to buy a feel a bit of , I feel a bit dizzy you know as if I",feel a bit ah I mean I 'm sorry I do have to buy a feel a bit of 
kb7-fragment31_11427_31,feel,1.0,VERB,VBP,"no I 'm alright Ann , I mean , feel a bit ah I mean I 'm sorry I do have to buy a feel a bit of , I feel a bit dizzy you know as if I",I feel a bit dizzy you know as if I
kb7-fragment31_11431_14,feel,1.0,VERB,VBP,"alright , yeah I am I mean I 'm not alright , I feel very dizzy , like I say I feel I feel a bit kind of heady you know but I will go and have a check up .",I feel very dizzy 
kb7-fragment31_11440_22,get,0.0,AUX,VB,"I 'll tell you what I said erm ah ah ah ah she 's talking to herself , but Ann will get on to you she 'll think I have n't done it !",but Ann will get on to you she 'll think I have n't done it !
kb7-fragment31_11443_4,call,1.0,VERB,VB,We I 'll call in,We I 'll call in
kb7-fragment31_11444_3,call,1.0,VERB,VB,"We 'll call in , that will be better than phoning at least you know you know you 're gon na get there .",We 'll call in 
kb7-fragment31_11452_1,take,0.0,VERB,VB,take you up .,take you up .
kb7-fragment31_11463_3,call,1.0,VERB,VB,We 'll call in .,We 'll call in .
kb7-fragment31_11464_3,call,1.0,VERB,VB,We 'll call in,We 'll call in
kb7-fragment31_11466_3,call,1.0,VERB,VB,We 'll call,We 'll call
kb7-fragment31_11478_3,see,0.0,VERB,VB,Let me see .,Let me see .
kb7-fragment31_11484_6,get,0.0,AUX,VB,Well I mean I can get that up the end .,Well I mean I can get that up the end .
kb7-fragment31_11486_4,get,0.0,AUX,VB,Might as well get it in town .,Might as well get it in town .
kb7-fragment31_11541_16,hit,0.0,VERB,VB,"I 've got some cooking apples out there Oh is n't he , I could hit him !",I could hit him !
kb7-fragment31_11555_5,got,0.0,VERB,VBN,"Oh I have n't got that long to make them , yet am I ?",Oh I have n't got that long to make them 
kb7-fragment31_11559_7,see,0.0,VERB,VB,"Go and have a look , see what you got .",see what you got .
kb7-fragment31_11575_3,sound,1.0,VERB,VB,Do n't sound a lot of weight but,Do n't sound a lot of weight but
kb7-fragment45_12895_5,seen,1.0,VERB,VBN,"First he 's never seen , surprises he 's always .",First he 's never seen 
kb7-fragment45_12922_5,spread,1.0,VERB,VB,If I want it spread around .,If I want it spread around .
kb7-fragment45_12934_4,got,1.0,VERB,VBD,"We ai n't got a , just a mad man !",We ai n't got a 
kb7-fragment45_12935_14,Welcome,0.0,PROPN,NNP,"He wo n't last for a ten now done the , done the Welcome Break , they done the Char Grill , now they 're on the Tescos .",done the Welcome Break 
kb7-fragment45_12952_11,got,0.0,VERB,VBD,"Well , you 'll have nine bulbs and lights out got a thousand to do Ann 's had",you 'll have nine bulbs and lights out got a thousand to do Ann 's had
kb7-fragment45_12955_4,got,0.0,VERB,VBN,I 've only got a thousand Sainsburys to do and we 'll be all done by,I 've only got a thousand Sainsburys to do and we 'll be all done by
kb7-fragment45_12959_4,get,0.0,AUX,VB,"Probably trying to get ahead for that , one of those .",Probably trying to get ahead for that 
kb7-fragment45_12966_9,carry,0.0,VERB,VB,"Well , with all the trussing the might carry on trussing and get that done .",with all the trussing the might carry on trussing and get that done .
kb7-fragment45_12966_13,get,0.0,AUX,VB,"Well , with all the trussing the might carry on trussing and get that done .",with all the trussing the might carry on trussing and get that done .
kb7-fragment45_12985_3,got,0.0,VERB,VBD,"So we got a thousand letters to do that 's all , well it might be over I do n't know they 're but",So we got a thousand letters to do that 's all 
kb7-fragment45_12993_11,came,0.0,VERB,VBD,"They 've all finished early , they 've unless they came in late with the order or something , extras or something .",they 've unless they came in late with the order or something 
kb7-fragment45_12994_11,gave,0.0,VERB,VBD,I know five hundred and sixty was extra cos Stuart gave me two hundred short of a thousand .,I know five hundred and sixty was extra cos Stuart gave me two hundred short of a thousand .
kb7-fragment45_12996_4,calculated,0.0,ADJ,JJ,Probably ai n't calculated enough have they ?,Probably ai n't calculated enough have they ?
kb7-fragment45_12997_8,calculated,0.0,VERB,VBN,No that 's what I say if calculated wrong,No that 's what I say if calculated wrong
kb7-fragment45_13000_2,go,1.0,VERB,VB,to go over do n't they ?,to go over do n't they ?
kb7-fragment45_13004_7,come,1.0,VERB,VBN,Bags that were n't that have come over there and need a recount Kerry !,Bags that were n't that have come over there and need a recount Kerry !
kb7-fragment45_13004_11,need,0.0,VERB,VB,Bags that were n't that have come over there and need a recount Kerry !,Bags that were n't that have come over there and need a recount Kerry !
kb7-fragment45_13017_3,put,0.0,VERB,VBD,"you see put John , one of us start trussing early but we did n't need one Ann 's got another team in the other room doing it .",you see put John 
kb7-fragment45_13025_6,go,0.0,VERB,VB,Actually they perhaps let us go back on them then,Actually they perhaps let us go back on them then
kb7-fragment45_13029_3,go,0.0,VERB,VB,"You mean go back on them , cos we did n't finish them cos there was three pallets and we did n't even do two .",You mean go back on them 
kb7-fragment45_13035_4,feel,0.0,VERB,VBP,"I bet you feel like a now , give them in when they ca n't truss them du n no .",I bet you feel like a now 
kb7-fragment45_13039_40,start,1.0,VERB,VB,"Well , with the two lines going yeah would have been about right then but see , John I do n't suppose he realised Ann was gon na fetch all the people out of here there and everywhere and start that up .",John I do n't suppose he realised Ann was gon na fetch all the people out of here there and everywhere and start that up .
kb7-fragment45_13046_16,start,1.0,VERB,VB,"I suppose that 's what John thought , we might not get them done , start early and get them finished",start early and get them finished
kb7-fragment45_13046_19,get,1.0,AUX,VB,"I suppose that 's what John thought , we might not get them done , start early and get them finished",start early and get them finished
kb7-fragment45_13049_3,gone,0.0,VERB,VBN,That was gone seven o'clock when,That was gone seven o'clock when
kb7-fragment45_13064_2,getting,0.0,VERB,VBG,And getting all the Bird 's Eye .,And getting all the Bird 's Eye .
kb7-fragment45_13066_3,get,0.0,VERB,VBP,If we get in trainee .,If we get in trainee .
kb7-fragment45_13067_11,putting,0.0,VERB,VBG,in the daytime I 'm going home I 'm not putting up with like that !,in the daytime I 'm going home I 'm not putting up with like that !
kb7-fragment45_13069_15,got,0.0,VERB,VBD,"Never mind you got as far as you could , so at least you got that far Deirdre .",so at least you got that far Deirdre .
kb7-fragment45_13072_6,come,1.0,VERB,VBP,"Joe and I mean I come a long way and they said he told them I wan na pop in Friday morning before we go He was surprised He said well I were n't surprised , I said but er you know I want a name yeah well , he just said well I ca n't he ca n't fault me on anything .",Joe and I mean I come a long way and they said he told them I wan na pop in Friday morning before we go He was surprised He said well I were n't surprised 
kb7-fragment45_13072_19,pop,1.0,NOUN,NN,"Joe and I mean I come a long way and they said he told them I wan na pop in Friday morning before we go He was surprised He said well I were n't surprised , I said but er you know I want a name yeah well , he just said well I ca n't he ca n't fault me on anything .",Joe and I mean I come a long way and they said he told them I wan na pop in Friday morning before we go He was surprised He said well I were n't surprised 
kb7-fragment45_13072_42,know,1.0,VERB,VBP,"Joe and I mean I come a long way and they said he told them I wan na pop in Friday morning before we go He was surprised He said well I were n't surprised , I said but er you know I want a name yeah well , he just said well I ca n't he ca n't fault me on anything .",I said but er you know I want a name yeah well 
kb7-fragment45_13082_3,work,0.0,VERB,VB,I 'll work it out,I 'll work it out
