token_id,query,metaphor,pos,fgpos,sentence,local
a7w-fragment01_16_37,living,1.0,VERB,VBG,"Government fixes the format in which BR has to work ; and if , as the Hidden report attests , many of its problems today reflect lack of past planning , lack of farsighted investment , living from hand to mouth , then that is not just BR 's doing .",living from hand to mouth 
a7w-fragment01_22_18,running,0.0,VERB,VBG,"The only accident and emergency relief was provided by the police , part-time St John ambulance volunteers running 20 vehicles , and the Red Cross .",part-time St John ambulance volunteers running 20 vehicles 
a7w-fragment01_29_4,accused,1.0,VERB,VBD,The Health Secretary accused the unions of ‘ posturing and pretending ’ to run a 999 service yesterday .,The Health Secretary accused the unions of ‘ posturing and pretending ’ to run a 999 service yesterday .
a7w-fragment01_29_11,pretending,1.0,NOUN,NN,The Health Secretary accused the unions of ‘ posturing and pretending ’ to run a 999 service yesterday .,The Health Secretary accused the unions of ‘ posturing and pretending ’ to run a 999 service yesterday .
a7w-fragment01_31_14,ended,0.0,VERB,VBN,"By refusing to keep open two-way radio links , the crews had effectively ended a proper emergency service .",the crews had effectively ended a proper emergency service .
a7w-fragment01_33_3,posturing,1.0,VERB,VBG,But ‘ posturing and pretending ’ went far beyond the unions .,But ‘ posturing and pretending ’ went far beyond the unions .
a7w-fragment01_33_5,pretending,1.0,NOUN,NN,But ‘ posturing and pretending ’ went far beyond the unions .,But ‘ posturing and pretending ’ went far beyond the unions .
a7w-fragment01_35_35,compared,1.0,VERB,VBN,"Yet it was Mr Clarke , not Mr Nichol , who was involved in the critical decisions — the cash limit for the NHS , the 6.5 per cent offer to ambulance workers ( compared to seven per cent for nurses , eight per cent for doctors and nine per cent for ancillary workers ) ; and today 's introduction of military ambulances .",the 6.5 per cent offer to ambulance workers ( compared to seven per cent for nurses 
a7w-fragment01_36_7,deserve,0.0,VERB,VB,Ambulance workers on emergency work do deserve a much higher increase .,Ambulance workers on emergency work do deserve a much higher increase .
a7w-fragment01_39_23,maintain,0.0,VERB,VB,"The crews are able to resuscitate heart attack patients , replace fluid intraveneously after severe blood loss , and insert tubes to maintain air supplies in unconconscious casualties .",and insert tubes to maintain air supplies in unconconscious casualties .
a7w-fragment01_40_17,given,0.0,VERB,VBN,"Yet the ambulance worker is only being offered £10,000 , when a fire officer is being given £13,000 and a Metropolitan police constable can earn £25,000 .","when a fire officer is being given £13,000 and a Metropolitan police constable can earn £25,000 ."
a7w-fragment01_42_14,carried,1.0,VERB,VBN,"Nine out of 10 are routine calls , many of which could be carried out by mini cabs .",many of which could be carried out by mini cabs .
a7w-fragment01_46_16,lost,0.0,VERB,VBN,The ramshackle Whitley Council negotiating machinery is the other reason why the ambulance workers have lost out .,The ramshackle Whitley Council negotiating machinery is the other reason why the ambulance workers have lost out .
a7w-fragment01_48_4,noted,1.0,VERB,VBD,"As Lord McCarthy noted some 13 years ago , the management side of the councils comprise ‘ employers who do not pay and paymasters who do not employ . ’",As Lord McCarthy noted some 13 years ago 
a7w-fragment01_49_12,negotiate,0.0,VERB,VB,A much more flexible system which would allow local managers to negotiate local rates — on a national pay spine — is needed .,A much more flexible system which would allow local managers to negotiate local rates — on a national pay spine — is needed .
a7w-fragment01_54_24,laying,0.0,VERB,VBG,"He needs to be for the next four days in Hong Kong , because he will be hard at work cutting ribbons and laying foundation stones .",because he will be hard at work cutting ribbons and laying foundation stones .
a7w-fragment01_56_7,opened,1.0,VERB,VBN,He is even re-opening the already opened Eastern Harbour tunnel and subway crossing .,He is even re-opening the already opened Eastern Harbour tunnel and subway crossing .
a7w-fragment01_58_21,declare,0.0,VERB,VB,"The whole point of a visit to Hong Kong now , five months after Tiananmen Square , should be to declare with royal authority that Britain shares the concerns of the Hong Kong people and is determined to do something about them .",should be to declare with royal authority that Britain shares the concerns of the Hong Kong people and is determined to do something about them .
a7w-fragment01_58_37,determined,1.0,ADJ,JJ,"The whole point of a visit to Hong Kong now , five months after Tiananmen Square , should be to declare with royal authority that Britain shares the concerns of the Hong Kong people and is determined to do something about them .",should be to declare with royal authority that Britain shares the concerns of the Hong Kong people and is determined to do something about them .
a7w-fragment01_62_4,help,0.0,VERB,VB,"It did not help at all that upon arrival yesterday the royal couple instantly touched base in that comforting symbol of past British power , the Hong Kong and Shanghai Bank .",It did not help at all that upon arrival yesterday the royal couple instantly touched base in that comforting symbol of past British power 
a7w-fragment01_63_9,use,0.0,VERB,VB,If there is a failure of imagination to use the royal visit creatively it will also be a failure of nerve .,If there is a failure of imagination to use the royal visit creatively it will also be a failure of nerve .
a7w-fragment01_64_5,decide,1.0,VERB,VB,Britain still can not decide when to play the mandarinate game of silence with the Chinese and when to break the rules ( as Beijing does all the time . ),Britain still can not decide when to play the mandarinate game of silence with the Chinese and when to break the rules ( as Beijing does all the time . )
a7w-fragment01_65_19,communicated,1.0,VERB,VBN,"The ideal tactics should be a mixture of both , but only if a clear message can be communicated to the Hong Kong people that someone is standing up for them somewhere .",but only if a clear message can be communicated to the Hong Kong people that someone is standing up for them somewhere .
a7w-fragment01_68_8,published,1.0,VERB,VBN,"The government denies this , but has published the text of a letter from its Political Adviser to the New China News Agency ( Beijing 's embassy in Hong Kong ) suggesting that it did .",but has published the text of a letter from its Political Adviser to the New China News Agency ( Beijing 's embassy in Hong Kong ) suggesting that it did .
a7w-fragment01_71_2,ends,0.0,VERB,VBZ,It ends by assuring Beijing that the Hong Kong Government will have ‘ a prudent regard for the special circumstances of Hong Kong and the interests and concerns of the Chinese Government . ’,It ends by assuring Beijing that the Hong Kong Government will have ‘ a prudent regard for the special circumstances of Hong Kong and the interests and concerns of the Chinese Government . ’
a7w-fragment01_71_4,assuring,1.0,VERB,VBG,It ends by assuring Beijing that the Hong Kong Government will have ‘ a prudent regard for the special circumstances of Hong Kong and the interests and concerns of the Chinese Government . ’,It ends by assuring Beijing that the Hong Kong Government will have ‘ a prudent regard for the special circumstances of Hong Kong and the interests and concerns of the Chinese Government . ’
a7w-fragment01_74_24,threatened,0.0,VERB,VBN,"The only two Hong Kong legislators who consistently dare to speak out , Mr Martin Lee and Mr Szeto Wah , have been threatened with expulsion from the committee now drafting China 's post-1997 Basic Law .",have been threatened with expulsion from the committee now drafting China 's post-1997 Basic Law .
a7w-fragment01_74_31,drafting,0.0,VERB,VBG,"The only two Hong Kong legislators who consistently dare to speak out , Mr Martin Lee and Mr Szeto Wah , have been threatened with expulsion from the committee now drafting China 's post-1997 Basic Law .",have been threatened with expulsion from the committee now drafting China 's post-1997 Basic Law .
a7w-fragment01_75_9,pick,0.0,VERB,VB,Our latest Foreign Secretary has yet to publicly pick up the file marked Hong Kong .,Our latest Foreign Secretary has yet to publicly pick up the file marked Hong Kong .
a7w-fragment01_75_13,marked,0.0,VERB,VBD,Our latest Foreign Secretary has yet to publicly pick up the file marked Hong Kong .,Our latest Foreign Secretary has yet to publicly pick up the file marked Hong Kong .
a7w-fragment01_76_5,dithering,0.0,VERB,VBG,There is still endless dithering on how broad a ‘ safety net ’ Britain will extend to its citizens .,There is still endless dithering on how broad a ‘ safety net ’ Britain will extend to its citizens .
aa3-fragment08_213_4,turned,0.0,VERB,VBD,The day thrift turned into a nightmare .,The day thrift turned into a nightmare .
aa3-fragment08_219_23,supplement,0.0,VERB,VB,"A life of saving had , by 1985 , given them a small nest-egg of £15,000 on which the interest would help supplement their pensions .","given them a small nest-egg of £15,000 on which the interest would help supplement their pensions ."
aa3-fragment08_223_10,turned,0.0,VERB,VBD,"Until one morning in June 1988 when George Tyson turned on the radio to hear a small , investment business called Barlow Clowes had collapsed .",Until one morning in June 1988 when George Tyson turned on the radio to hear a small 
aa3-fragment08_226_2,determined,0.0,VERB,VBD,"Fate determined that a short while before the businesses failed , they transferred the £10,000 to BCI because of the better returns being offered .",Fate determined that a short while before the businesses failed 
aa3-fragment08_226_13,transferred,1.0,VERB,VBD,"Fate determined that a short while before the businesses failed , they transferred the £10,000 to BCI because of the better returns being offered .","they transferred the £10,000 to BCI because of the better returns being offered ."
aa3-fragment08_226_24,offered,0.0,VERB,VBN,"Fate determined that a short while before the businesses failed , they transferred the £10,000 to BCI because of the better returns being offered .","they transferred the £10,000 to BCI because of the better returns being offered ."
aa3-fragment08_229_10,grew,0.0,VERB,VBD,"After the initial shock and disbelief , the Tysons grew angry — at the advisers who convinced them about Barlow Clowes , at the Midland bank manager who gave verbal assurances of its security , at the regulatory authorities responsible for the investment community and at the Department of Trade and Industry which allowed the company to trade .",the Tysons grew angry — at the advisers who convinced them about Barlow Clowes 
aa3-fragment08_231_12,treated,0.0,VERB,VBN,‘ I feel appalled by the way these professional guardians have treated us .,‘ I feel appalled by the way these professional guardians have treated us .
aa3-fragment08_232_5,gambling,1.0,NOUN,NN,"If you were a gambling man it would not affect you , it would just be lost .",If you were a gambling man it would not affect you 
aa3-fragment08_235_10,blamed,0.0,VERB,VBD,"Ironically , it was the Government which he partly blamed for the affair that gave him the chance to return to work after retirement .",it was the Government which he partly blamed for the affair that gave him the chance to return to work after retirement .
aa3-fragment08_236_28,carries,0.0,VERB,VBZ,"A change in the tax rules affecting pensions was shortly followed by a job with the Department of Environment 's Property Services Agency , a post which carries him through to March and may see him stay until he is 70 .",a post which carries him through to March and may see him stay until he is 70 .
aa3-fragment08_241_6,cost,0.0,VERB,VBN,Pursuing legal action would have cost them money they did n't have ( unless it meant selling their house which was not an option ) but doing nothing left them with the feeling that justice was n't being done .,Pursuing legal action would have cost them money they did n't have ( unless it meant selling their house which was not an option ) but doing nothing left them with the feeling that justice was n't being done .
aa3-fragment08_242_3,compromised,0.0,VERB,VBD,So they compromised and gave £100 to the Barlow Clowes Investors Group which was formed last July to represent the investors ' interests and co-ordinate the fight for compensation .,So they compromised and gave £100 to the Barlow Clowes Investors Group which was formed last July to represent the investors ' interests and co-ordinate the fight for compensation .
aa3-fragment08_242_5,gave,0.0,VERB,VBD,So they compromised and gave £100 to the Barlow Clowes Investors Group which was formed last July to represent the investors ' interests and co-ordinate the fight for compensation .,So they compromised and gave £100 to the Barlow Clowes Investors Group which was formed last July to represent the investors ' interests and co-ordinate the fight for compensation .
aa3-fragment08_244_12,talking,1.0,VERB,VBG,‘ They are dedicated people who clearly know what they are talking about and have guided us through it .,‘ They are dedicated people who clearly know what they are talking about and have guided us through it .
aa3-fragment08_247_6,see,0.0,VERB,VB,The Tysons have yet to see any cash payment from the liquidators who have been winding up BCI 's affairs .,The Tysons have yet to see any cash payment from the liquidators who have been winding up BCI 's affairs .
aa3-fragment08_248_7,remains,0.0,VERB,VBZ,What little money has been recovered remains the subject of a legal tussle in the courts which may yet take months to resolve .,What little money has been recovered remains the subject of a legal tussle in the courts which may yet take months to resolve .
aa3-fragment08_248_23,resolve,0.0,VERB,VB,What little money has been recovered remains the subject of a legal tussle in the courts which may yet take months to resolve .,What little money has been recovered remains the subject of a legal tussle in the courts which may yet take months to resolve .
aa3-fragment08_249_4,told,0.0,VERB,VBN,"They have been told that their claim may only amount to around £11,000 of their £15,000 as capital gains tax is likely to be deducted from the total .","They have been told that their claim may only amount to around £11,000 of their £15,000 as capital gains tax is likely to be deducted from the total ."
aa3-fragment08_249_25,deducted,0.0,VERB,VBN,"They have been told that their claim may only amount to around £11,000 of their £15,000 as capital gains tax is likely to be deducted from the total .","They have been told that their claim may only amount to around £11,000 of their £15,000 as capital gains tax is likely to be deducted from the total ."
aa3-fragment08_250_4,get,0.0,VERB,VBP,"But until they get any money back , the Tysons find themselves in the position of the gambler who gambled all and lost .",But until they get any money back 
aa3-fragment08_250_20,gambled,1.0,VERB,VBD,"But until they get any money back , the Tysons find themselves in the position of the gambler who gambled all and lost .",the Tysons find themselves in the position of the gambler who gambled all and lost .
ahc-fragment61_1252_6,progress,1.0,VERB,VBP,Travel : A pilgrimage sans progress Elisabeth de Stroumillo potters round Poitou,Travel : A pilgrimage sans progress Elisabeth de Stroumillo potters round Poitou
ahc-fragment61_1254_4,look,1.0,VERB,VB,PEOPLE tend to look vague when you mention Poitou .,PEOPLE tend to look vague when you mention Poitou .
ahc-fragment61_1261_9,found,1.0,VERB,VBN,"Even for France , the variety to be found is enormous .",the variety to be found is enormous .
ahc-fragment61_1262_45,going,1.0,VERB,VBG,"My passion is for its numerous Romanesque churches , in most cases humbly proportioned but elevated into unique works of art by the richness of their exquisitely-sculpted decoration ; to go to Poitou/Saintonge and not look at any of its churches would be like going to an African game reserve and ignoring the animals .",in most cases humbly proportioned but elevated into unique works of art by the richness of their exquisitely-sculpted decoration ; to go to Poitou/Saintonge and not look at any of its churches would be like going to an African game reserve and ignoring the animals .
ahc-fragment61_1262_52,ignoring,1.0,VERB,VBG,"My passion is for its numerous Romanesque churches , in most cases humbly proportioned but elevated into unique works of art by the richness of their exquisitely-sculpted decoration ; to go to Poitou/Saintonge and not look at any of its churches would be like going to an African game reserve and ignoring the animals .",in most cases humbly proportioned but elevated into unique works of art by the richness of their exquisitely-sculpted decoration ; to go to Poitou/Saintonge and not look at any of its churches would be like going to an African game reserve and ignoring the animals .
ahc-fragment61_1263_11,investigate,0.0,VERB,VB,"For serious drinkers there is the production of cognac to investigate around Cognac , plus the chance to sample pineau , the powerful local aperitif made from young wine laced with cognac .",For serious drinkers there is the production of cognac to investigate around Cognac 
ahc-fragment61_1263_26,made,0.0,VERB,VBN,"For serious drinkers there is the production of cognac to investigate around Cognac , plus the chance to sample pineau , the powerful local aperitif made from young wine laced with cognac .",the powerful local aperitif made from young wine laced with cognac .
ahc-fragment61_1266_31,drain,0.0,VERB,VB,"The lower reaches of the Sevre Niortaise are swollen with the waters that once covered the whole area , until medieval monks started to dig a spider-web of ditches to drain it .",until medieval monks started to dig a spider-web of ditches to drain it .
ahc-fragment61_1268_19,twisting,1.0,NOUN,NN,"Drifting between grassy polders to which farmers have to ferry their cattle in punts , or following leafy twisting lanes marked only by rusty signs proclaiming the ‘ Venise Verte ’ , you 're in an all-green , mysteriously silent world ; only the occasional fisherman , twitching his rod above the algae-smothered waters , disturbs the stillness .",or following leafy twisting lanes marked only by rusty signs proclaiming the ‘ Venise Verte ’ 
ahc-fragment61_1268_21,marked,1.0,VERB,VBN,"Drifting between grassy polders to which farmers have to ferry their cattle in punts , or following leafy twisting lanes marked only by rusty signs proclaiming the ‘ Venise Verte ’ , you 're in an all-green , mysteriously silent world ; only the occasional fisherman , twitching his rod above the algae-smothered waters , disturbs the stillness .",or following leafy twisting lanes marked only by rusty signs proclaiming the ‘ Venise Verte ’ 
ahc-fragment61_1268_53,algae-smothered,1.0,ADJ,JJ,"Drifting between grassy polders to which farmers have to ferry their cattle in punts , or following leafy twisting lanes marked only by rusty signs proclaiming the ‘ Venise Verte ’ , you 're in an all-green , mysteriously silent world ; only the occasional fisherman , twitching his rod above the algae-smothered waters , disturbs the stillness .",twitching his rod above the algae-smothered waters 
ahc-fragment61_1269_43,raised,1.0,VERB,VBN,"There is more greenery further south in the deep forest of Chize ( with the fine Renaissance chateau of Dampierre-sur-Boutonne at its edge ) ; and more marshes to the west around Rochefort and Marennes , where those mussels and oysters are raised .",where those mussels and oysters are raised .
ahc-fragment61_1279_1,Wriggling,1.0,VERB,VBG,"Wriggling across country on the D216 to Port-d'Envaux , you come to two more chateaux : 18th-century Panloy , flaking romantically away on its hillock overlooking a bend in the Charente and , almost next door , the much older , moated Crazannes , half-smothered in amazing flamboyant Gothic carving .",Wriggling across country on the D216 to Port-d'Envaux 
ahc-fragment61_1279_20,flaking,0.0,VERB,VBG,"Wriggling across country on the D216 to Port-d'Envaux , you come to two more chateaux : 18th-century Panloy , flaking romantically away on its hillock overlooking a bend in the Charente and , almost next door , the much older , moated Crazannes , half-smothered in amazing flamboyant Gothic carving .",flaking romantically away on its hillock overlooking a bend in the Charente and 
ahc-fragment61_1279_45,half-smothered,1.0,ADJ,JJ,"Wriggling across country on the D216 to Port-d'Envaux , you come to two more chateaux : 18th-century Panloy , flaking romantically away on its hillock overlooking a bend in the Charente and , almost next door , the much older , moated Crazannes , half-smothered in amazing flamboyant Gothic carving .",half-smothered in amazing flamboyant Gothic carving .
ahc-fragment61_1294_3,recur,0.0,NOUN,NN,"Biblical motifs recur — some art-experts call them sermons in stone , and their messages would certainly have been clear to the often-illiterate medieval pilgrims trudging to Santiago de Compostela in Spain .",Biblical motifs recur — some art-experts call them sermons in stone 
ahc-fragment61_1294_7,call,0.0,VERB,VBP,"Biblical motifs recur — some art-experts call them sermons in stone , and their messages would certainly have been clear to the often-illiterate medieval pilgrims trudging to Santiago de Compostela in Spain .",Biblical motifs recur — some art-experts call them sermons in stone 
ahc-fragment61_1295_6,interspersed,0.0,VERB,VBN,"But these themes are always interspersed with more fanciful ones : grimacing masks , weird animals , exuberant abstract patterns .",But these themes are always interspersed with more fanciful ones : grimacing masks 
ahc-fragment61_1296_9,motivated,0.0,ADJ,JJ,"I think those 10th- and 11th-century sculptors were motivated not just by piety but also by a certain competitive spirit : if a church was finer than the one in the next village , more pilgrims would surely pause there .",I think those 10th- and 11th-century sculptors were motivated not just by piety but also by a certain competitive spirit : if a church was finer than the one in the next village 
ahc-fragment61_1297_9,lure,0.0,VERB,VB,Today 's attraction-merchants are doing no more to lure 20th-century tourists than their medieval forebears did for pilgrims .,Today 's attraction-merchants are doing no more to lure 20th-century tourists than their medieval forebears did for pilgrims .
ahd-fragment06_49_21,regulate,1.0,VERB,VB,MANY will take it as a further surrender to Common Market bureaucracy that an inspectorate will soon be established to regulate the smell of farm manure .,MANY will take it as a further surrender to Common Market bureaucracy that an inspectorate will soon be established to regulate the smell of farm manure .
ahd-fragment06_53_5,involve,1.0,VERB,VB,"It mostly seems to involve producing food for animals to eat , whose excrement is then collected to assist the growth of more food for animals .",It mostly seems to involve producing food for animals to eat 
ahd-fragment06_53_19,assist,1.0,VERB,VB,"It mostly seems to involve producing food for animals to eat , whose excrement is then collected to assist the growth of more food for animals .",whose excrement is then collected to assist the growth of more food for animals .
ahd-fragment06_54_43,give,1.0,VERB,VB,"Small children can sometimes be persuaded to eat cow cake in the same way that old people will eat cat food , but the chief result of all this farming was to produce huge food mountains which we could then refuse to give to the Third World , or to the socialists of Eastern Europe , in order to teach them the error of their ways .",but the chief result of all this farming was to produce huge food mountains which we could then refuse to give to the Third World 
ahd-fragment06_54_60,teach,0.0,VERB,VB,"Small children can sometimes be persuaded to eat cow cake in the same way that old people will eat cat food , but the chief result of all this farming was to produce huge food mountains which we could then refuse to give to the Third World , or to the socialists of Eastern Europe , in order to teach them the error of their ways .",in order to teach them the error of their ways .
ahd-fragment06_56_2,involves,1.0,VERB,VBZ,It involves nothing more than putting up 80-foot masts all over the land .,It involves nothing more than putting up 80-foot masts all over the land .
ahd-fragment06_59_13,producing,0.0,VERB,VBG,All the food we need will be provided by monster underground funguses producing a regular crop of mushrooms without human assistance .,All the food we need will be provided by monster underground funguses producing a regular crop of mushrooms without human assistance .
ahe-fragment03_36_21,prevail,0.0,VERB,VBP,"The Wolds , a remand centre at Brough , North Humberside , is far removed from the insanitary conditions which prevail at many jails .",is far removed from the insanitary conditions which prevail at many jails .
ahe-fragment03_40_23,await,1.0,VERB,VB,"Nail clippers , combs , toothpaste and toothbrushes , razors and washbags are neatly laid out on tables in the cells to await the arrival of inmates , many of whom will not be carrying such items because they may not have expected to be remanded in custody .",razors and washbags are neatly laid out on tables in the cells to await the arrival of inmates 
