token_id,query,metaphor,pos,fgpos,sentence,local
a1j-fragment33_496_28,restructuring,0.0,VERB,VBG,AN INCOMING Labour government would turn large areas of Whitehall upside down — but the party 's policy review barely considers the implications of its plans for restructuring government departments .,AN INCOMING Labour government would turn large areas of Whitehall upside down — but the party 's policy review barely considers the implications of its plans for restructuring government departments .
a1j-fragment33_500_12,declared,0.0,VERB,VBN,"In virtually every case the aim of causing upheaval is explicitly declared , because Labour 's aim would be to upset the bureaucratic order it inherits .",In virtually every case the aim of causing upheaval is explicitly declared 
a1j-fragment33_504_10,form,0.0,VERB,VB,"The ‘ medium term industrial strategy ’ which would form the centrepiece of Labour 's economic policy would , according to the Productive and Competitive Economy review group , be ‘ administered by a transformed Department of Trade and Industry ’ .",The ‘ medium term industrial strategy ’ which would form the centrepiece of Labour 's economic policy would 
a1j-fragment33_504_32,administered,0.0,VERB,VBN,"The ‘ medium term industrial strategy ’ which would form the centrepiece of Labour 's economic policy would , according to the Productive and Competitive Economy review group , be ‘ administered by a transformed Department of Trade and Industry ’ .",be ‘ administered by a transformed Department of Trade and Industry ’ .
a1j-fragment33_504_35,transformed,0.0,VERB,VBN,"The ‘ medium term industrial strategy ’ which would form the centrepiece of Labour 's economic policy would , according to the Productive and Competitive Economy review group , be ‘ administered by a transformed Department of Trade and Industry ’ .",be ‘ administered by a transformed Department of Trade and Industry ’ .
a1j-fragment33_505_9,seek,1.0,VERB,VBP,"The review adds : ‘ What we now seek is a DTI which will have an equal , if not superior status , to that of the Treasury . ’",The review adds : ‘ What we now seek is a DTI which will have an equal 
a1j-fragment33_508_23,ended,0.0,VERB,VBD,"But its last effort — the Department of Economic Affairs , set up by Harold Wilson and headed by George Brown — ended in futile departmental and ministerial infighting .",set up by Harold Wilson and headed by George Brown — ended in futile departmental and ministerial infighting .
a1j-fragment33_509_21,determing,1.0,VERB,VBG,"There would in addition be a minister for Science and Technology at the newly supreme DTI , with responsibility for determing investment in research .",with responsibility for determing investment in research .
a1j-fragment33_515_7,require,1.0,VERB,VB,"It would be able to ‘ require each government department to review its policies , practices , and existing and proposed legislation ’ .",It would be able to ‘ require each government department to review its policies 
a1j-fragment33_522_10,imagine,0.0,VERB,VB,That could work — though it is easy to imagine conflicts of interest with the housing and planning functions of the department .,That could work — though it is easy to imagine conflicts of interest with the housing and planning functions of the department .
a1j-fragment33_527_17,recommended,1.0,VERB,VBN,"That is the first of many agencies , executives , commissions , and other quango-like bodies recommended by the review .",and other quango-like bodies recommended by the review .
a1u-fragment04_57_13,facing,1.0,VERB,VBG,The disposal of toxic wastes is one of the most intractable problems facing industrialised societies .,The disposal of toxic wastes is one of the most intractable problems facing industrialised societies .
a1u-fragment04_58_32,got,1.0,VERB,VBN,"Even though some of the most dangerous and persistent toxins , including polychlorinated biphenyls , PCBs , are no longer manufactured , quantities of them still exist , and must be got rid of .",and must be got rid of .
a1u-fragment04_61_21,convince,1.0,VERB,VB,"On this page , Nick Roe visits a plant which , despite strenuous public relations efforts , has failed to convince its neighbours that it has come clean .",has failed to convince its neighbours that it has come clean .
a1u-fragment04_63_15,dropped,1.0,VERB,VBD,Then he pressed another knob and a big toy doll in his office window dropped its trousers .,Then he pressed another knob and a big toy doll in his office window dropped its trousers .
a1u-fragment04_67_13,awaiting,1.0,VERB,VBG,"Beyond the barrier lay some of the most toxic chemicals known , awaiting destruction by fire .",awaiting destruction by fire .
a1u-fragment04_70_6,covering,1.0,VERB,VBG,"Plus a backdrop of houses covering the valley walls on either side , a reminder that wherever industrialised societies decide to deal with their most intractable problems , they are unlikely to find a place to do so which is not in somebody 's back yard .",Plus a backdrop of houses covering the valley walls on either side 
a1u-fragment04_70_20,decide,1.0,VERB,VBP,"Plus a backdrop of houses covering the valley walls on either side , a reminder that wherever industrialised societies decide to deal with their most intractable problems , they are unlikely to find a place to do so which is not in somebody 's back yard .",a reminder that wherever industrialised societies decide to deal with their most intractable problems 
a1u-fragment04_70_33,find,1.0,VERB,VB,"Plus a backdrop of houses covering the valley walls on either side , a reminder that wherever industrialised societies decide to deal with their most intractable problems , they are unlikely to find a place to do so which is not in somebody 's back yard .",they are unlikely to find a place to do so which is not in somebody 's back yard .
a1u-fragment04_73_26,increased,0.0,VERB,VBN,"Then there are the imports : 83,000 tonnes of toxic waste enter British ports annually for incineration or other treatment , a figure which has increased 20-fold in just eight years .",a figure which has increased 20-fold in just eight years .
a1u-fragment04_75_4,turned,0.0,VERB,VBD,"Liverpool dockers recently turned back parts of a 1,500-tonne consignment of Canadian PCBs ( polychlorinated biphenyls ) bound for this plant in Gwent .","Liverpool dockers recently turned back parts of a 1,500-tonne consignment of Canadian PCBs ( polychlorinated biphenyls ) bound for this plant in Gwent ."
a1u-fragment04_76_22,shift,0.0,VERB,VB,"In doing so , they underlined a fact which is likely to attract more and more attention as tankers continue to shift toxins from town to town , country to country : the waste chain is long .",they underlined a fact which is likely to attract more and more attention as tankers continue to shift toxins from town to town 
a1u-fragment04_77_2,snakes,0.0,VERB,VBZ,"It snakes in and out of ports , along our busiest highways and through our most crowded cities .",It snakes in and out of ports 
a1u-fragment04_78_5,felt,1.0,VERB,VBN,Anxieties which are currently felt most acutely by those living near destruction plants themselves may not always remain so localised .,Anxieties which are currently felt most acutely by those living near destruction plants themselves may not always remain so localised .
a1u-fragment04_80_10,throw,0.0,VERB,VB,"Local people mutter and march , make speeches and throw things ; staff face sarcasm in nearby pubs ; and for years there have been demands for a public inquiry .",make speeches and throw things ; staff face sarcasm in nearby pubs ; and for years there have been demands for a public inquiry .
a1u-fragment04_81_19,issuing,0.0,VERB,VBG,"Rechem has responded with a rather desperate open-door policy aimed at soothing fears , and more recently by issuing about a dozen writs against the fiercest critics .",and more recently by issuing about a dozen writs against the fiercest critics .
a1u-fragment04_87_8,governing,0.0,VERB,VBG,"There was a fault on the computer governing the plant , said Mr Wheeler , and the fire had automatically shut down .",There was a fault on the computer governing the plant 
a1u-fragment04_103_5,lay,1.0,VERB,VBD,Piles of ruddy-brown ash lay heaped on the floor .,Piles of ruddy-brown ash lay heaped on the floor .
a1u-fragment04_105_2,shone,0.0,VERB,VBD,Heat shone out .,Heat shone out .
a1u-fragment04_111_6,destroy,0.0,VERB,VB,"PCBs are so difficult to destroy , that Rechem 's emission-monitoring systems are geared to detecting them on the grounds that if you destroy PCBs you destroy everything .",PCBs are so difficult to destroy 
a1u-fragment04_111_14,geared,0.0,VERB,VBN,"PCBs are so difficult to destroy , that Rechem 's emission-monitoring systems are geared to detecting them on the grounds that if you destroy PCBs you destroy everything .",that Rechem 's emission-monitoring systems are geared to detecting them on the grounds that if you destroy PCBs you destroy everything .
a1u-fragment04_126_23,broken,0.0,VERB,VBN,"Mr Wheeler , now moving to the rear of the plant to show off the £2m smoke-cleaning section , which had just broken down , pointed out that his company achieved destruction of at least 99.9999 per cent of all materials .",which had just broken down 
a1u-fragment04_126_31,achieved,1.0,VERB,VBD,"Mr Wheeler , now moving to the rear of the plant to show off the £2m smoke-cleaning section , which had just broken down , pointed out that his company achieved destruction of at least 99.9999 per cent of all materials .",pointed out that his company achieved destruction of at least 99.9999 per cent of all materials .
a1u-fragment04_127_5,imply,0.0,VERB,VBP,"The company 's figures imply that when you have burnt 99.9999 per cent of a 30,000-tonne annual throughput , a figure of 0.03 of a tonne remains .","The company 's figures imply that when you have burnt 99.9999 per cent of a 30,000-tonne annual throughput "
a1u-fragment04_127_10,burnt,0.0,VERB,VBN,"The company 's figures imply that when you have burnt 99.9999 per cent of a 30,000-tonne annual throughput , a figure of 0.03 of a tonne remains .","The company 's figures imply that when you have burnt 99.9999 per cent of a 30,000-tonne annual throughput "
a1u-fragment04_127_27,remains,1.0,VERB,VBZ,"The company 's figures imply that when you have burnt 99.9999 per cent of a 30,000-tonne annual throughput , a figure of 0.03 of a tonne remains .",a figure of 0.03 of a tonne remains .
a1u-fragment04_133_1,Stack,1.0,NOUN,NN,"Stack emissions of PCBs were below the American standard for breathing air - 1,000 times lower than the British equivalent .","Stack emissions of PCBs were below the American standard for breathing air - 1,000 times lower than the British equivalent ."
a1u-fragment04_134_6,showed,1.0,VERB,VBD,Regular soil and grass tests showed no difference between PCB contamination in the immediate area and elsewhere in Wales — though there are no established ‘ safe ’ levels for these .,Regular soil and grass tests showed no difference between PCB contamination in the immediate area and elsewhere in Wales — though there are no established ‘ safe ’ levels for these .
a1u-fragment04_136_17,check,0.0,VERB,VB,"And here were drums of chemicals , each labelled , each with a job number to check against sampling .",each with a job number to check against sampling .
a1u-fragment04_138_14,exploded,0.0,VERB,VBD,"In 1987 , aluminium melted in the furnace , reacted with water and exploded , sending a black cloud over nearby houses .",reacted with water and exploded 
a1u-fragment04_147_30,waiting,1.0,VERB,VBG,"In a large , prefabricated shed we wandered past stacks of 45-gallon drums of PCBs , two drums high , about 10 deep ; and there were contaminated transformers waiting to be cut up and roasted in the flames .",about 10 deep ; and there were contaminated transformers waiting to be cut up and roasted in the flames .
a1u-fragment04_147_33,cut,1.0,VERB,VBN,"In a large , prefabricated shed we wandered past stacks of 45-gallon drums of PCBs , two drums high , about 10 deep ; and there were contaminated transformers waiting to be cut up and roasted in the flames .",about 10 deep ; and there were contaminated transformers waiting to be cut up and roasted in the flames .
a1u-fragment04_149_18,refused,0.0,VERB,VBD,There was no difference between the liquid in these drums and the liquid in the cargoes they refused to touch .,There was no difference between the liquid in these drums and the liquid in the cargoes they refused to touch .
a1u-fragment04_150_15,admitted,0.0,VERB,VBD,"In Liverpool , a dockers ' spokesman with the Transport and General Workers Union admitted : ‘ Drivers are n't happy handling some of these commodities , but at least a lorry-driver has more idea of what he is handling than a docker , who could have a consignment and just not know what it is . ’",a dockers ' spokesman with the Transport and General Workers Union admitted : ‘ Drivers are n't happy handling some of these commodities 
a1u-fragment04_150_22,handling,0.0,VERB,VBG,"In Liverpool , a dockers ' spokesman with the Transport and General Workers Union admitted : ‘ Drivers are n't happy handling some of these commodities , but at least a lorry-driver has more idea of what he is handling than a docker , who could have a consignment and just not know what it is . ’",a dockers ' spokesman with the Transport and General Workers Union admitted : ‘ Drivers are n't happy handling some of these commodities 
a1u-fragment04_150_40,handling,0.0,VERB,VBG,"In Liverpool , a dockers ' spokesman with the Transport and General Workers Union admitted : ‘ Drivers are n't happy handling some of these commodities , but at least a lorry-driver has more idea of what he is handling than a docker , who could have a consignment and just not know what it is . ’",but at least a lorry-driver has more idea of what he is handling than a docker 
a1u-fragment04_151_17,represents,0.0,VERB,VBZ,"Yet he did not oppose all toxic waste movement ( after all , the same union represents workers at Rechem itself ) ; he simply did n't like the idea that big industrial nations like Canada could dump their dirty problems on this country and his members .",the same union represents workers at Rechem itself ) ; he simply did n't like the idea that big industrial nations like Canada could dump their dirty problems on this country and his members .
a1u-fragment04_152_18,called,1.0,VERB,VBD,"Driving away , I noticed that the vast chimney was still not functioning , but when I called at a neighbouring house a woman showed me videos she had taken of smoke coming from the plant , settling in her garden .",but when I called at a neighbouring house a woman showed me videos she had taken of smoke coming from the plant 
a1u-fragment04_156_37,shut,1.0,VERB,VBN,"‘ We must run it safely in the short term and long term , ’ he said , ‘ because if people are able to demonstrate that we are causing an environment problem we will be shut down . ’",‘ because if people are able to demonstrate that we are causing an environment problem we will be shut down . ’
a1u-fragment04_157_6,spilled,1.0,VERB,VBD,In April 1985 a tanker spilled 200 litres of PCBs over the main Trans-Canada Highway on the border between Ontario and Manitoba .,In April 1985 a tanker spilled 200 litres of PCBs over the main Trans-Canada Highway on the border between Ontario and Manitoba .
a1u-fragment04_158_7,shut,1.0,VERB,VBN,A section of the road was shut for a week and motorists were warned to clean their cars and to dispose of the rags in plastic bags .,A section of the road was shut for a week and motorists were warned to clean their cars and to dispose of the rags in plastic bags .
a31-fragment03_112_4,take,0.0,VERB,VB,Law : Always take along a friend to sue : Litigation can pay off even in the unlikeliest circumstances .,Law : Always take along a friend to sue : Litigation can pay off even in the unlikeliest circumstances .
a31-fragment03_112_13,pay,0.0,VERB,VB,Law : Always take along a friend to sue : Litigation can pay off even in the unlikeliest circumstances .,Law : Always take along a friend to sue : Litigation can pay off even in the unlikeliest circumstances .
a31-fragment03_115_3,go,0.0,VERB,VBP,WHEN things go wrong you can sue more often than you may think .,WHEN things go wrong you can sue more often than you may think .
a31-fragment03_119_9,owed,0.0,VERB,VBD,"As long as you can show that they owed you a legal duty to be careful and have been negligent , damages could come your way .",As long as you can show that they owed you a legal duty to be careful and have been negligent 
a31-fragment03_121_1,Take,0.0,VERB,VB,"Take up references before giving credit , lending money , letting in tenants , taking on staff .",Take up references before giving credit 
a31-fragment03_121_15,taking,0.0,VERB,VBG,"Take up references before giving credit , lending money , letting in tenants , taking on staff .",taking on staff .
a31-fragment03_122_4,building,0.0,NOUN,NN,"Ask banks , building societies , former landlords , present and past employers .",building societies 
a31-fragment03_125_1,Take,0.0,VERB,VB,"Take along a prosperous adviser on all shopping sprees , demonstrate a high degree of trust and strong reliance in what they say and you may have unexpected protection should the seller go out of business and the goods fall to pieces .",Take along a prosperous adviser on all shopping sprees 
a31-fragment03_125_33,go,0.0,VERB,VB,"Take along a prosperous adviser on all shopping sprees , demonstrate a high degree of trust and strong reliance in what they say and you may have unexpected protection should the seller go out of business and the goods fall to pieces .",demonstrate a high degree of trust and strong reliance in what they say and you may have unexpected protection should the seller go out of business and the goods fall to pieces .
a31-fragment03_130_2,bought,1.0,VERB,VBD,She bought it .,She bought it .
a31-fragment03_132_9,upheld,0.0,VERB,VBD,"In May last year the Court of Appeal upheld a judgment against the friend for more than £5,500 damages for negligence because he had owed the accountant a duty of care .","In May last year the Court of Appeal upheld a judgment against the friend for more than £5,500 damages for negligence because he had owed the accountant a duty of care ."
a31-fragment03_132_25,owed,0.0,VERB,VBN,"In May last year the Court of Appeal upheld a judgment against the friend for more than £5,500 damages for negligence because he had owed the accountant a duty of care .","In May last year the Court of Appeal upheld a judgment against the friend for more than £5,500 damages for negligence because he had owed the accountant a duty of care ."
a31-fragment03_133_3,collapses,0.0,VERB,VBZ,Your conservatory collapses as a result of negligence of the professionals who were engaged by the previous owner to put it up .,Your conservatory collapses as a result of negligence of the professionals who were engaged by the previous owner to put it up .
a31-fragment03_133_14,engaged,0.0,VERB,VBN,Your conservatory collapses as a result of negligence of the professionals who were engaged by the previous owner to put it up .,Your conservatory collapses as a result of negligence of the professionals who were engaged by the previous owner to put it up .
a31-fragment03_133_20,put,0.0,VERB,VB,Your conservatory collapses as a result of negligence of the professionals who were engaged by the previous owner to put it up .,Your conservatory collapses as a result of negligence of the professionals who were engaged by the previous owner to put it up .
a31-fragment03_135_15,occurred,1.0,VERB,VBD,"There are strict time limits : generally , six years from when damage first occurred ; where the damage was initially ‘ latent ’ you are given longer — three years from when you could have discovered it , with a longstop of 15 years .",six years from when damage first occurred ; where the damage was initially ‘ latent ’ you are given longer — three years from when you could have discovered it 
a31-fragment03_136_15,failing,1.0,VERB,VBG,It may also be possible to claim damages against a local authority for negligently failing to ensure that construction work complied with the relevant building regulations .,It may also be possible to claim damages against a local authority for negligently failing to ensure that construction work complied with the relevant building regulations .
a31-fragment03_136_21,complied,1.0,VERB,VBN,It may also be possible to claim damages against a local authority for negligently failing to ensure that construction work complied with the relevant building regulations .,It may also be possible to claim damages against a local authority for negligently failing to ensure that construction work complied with the relevant building regulations .
a31-fragment03_137_3,fails,0.0,VERB,VBZ,A solicitor fails to draw up a will within a reasonable time for a client who subsequently dies .,A solicitor fails to draw up a will within a reasonable time for a client who subsequently dies .
a31-fragment03_137_5,draw,0.0,VERB,VB,A solicitor fails to draw up a will within a reasonable time for a client who subsequently dies .,A solicitor fails to draw up a will within a reasonable time for a client who subsequently dies .
a31-fragment03_143_8,decided,1.0,VERB,VBD,This is what the House of Lords decided in two cases last April in spite of an attempt to get the valuers off the hook by a disclaimer which said : ‘ I accept that the valuer does not warrant anything stated in his report as being accurate …,This is what the House of Lords decided in two cases last April in spite of an attempt to get the valuers off the hook by a disclaimer which said : ‘ I accept that the valuer does not warrant anything stated in his report as being accurate …
a31-fragment03_143_40,warrant,0.0,VERB,VB,This is what the House of Lords decided in two cases last April in spite of an attempt to get the valuers off the hook by a disclaimer which said : ‘ I accept that the valuer does not warrant anything stated in his report as being accurate …,This is what the House of Lords decided in two cases last April in spite of an attempt to get the valuers off the hook by a disclaimer which said : ‘ I accept that the valuer does not warrant anything stated in his report as being accurate …
a31-fragment03_143_42,stated,0.0,VERB,VBN,This is what the House of Lords decided in two cases last April in spite of an attempt to get the valuers off the hook by a disclaimer which said : ‘ I accept that the valuer does not warrant anything stated in his report as being accurate …,This is what the House of Lords decided in two cases last April in spite of an attempt to get the valuers off the hook by a disclaimer which said : ‘ I accept that the valuer does not warrant anything stated in his report as being accurate …
a31-fragment03_147_18,collapsing,0.0,VERB,VBG,But a disclaimer can never take away your rights under the Defective Premises Act 1972 for the collapsing conservatory or prevent anyone being sued for negligence which has caused death or injury .,But a disclaimer can never take away your rights under the Defective Premises Act 1972 for the collapsing conservatory or prevent anyone being sued for negligence which has caused death or injury .
a31-fragment03_149_4,followed,0.0,VERB,VBD,Or after we followed the duff advice of a legal journalist in a newspaper ?,Or after we followed the duff advice of a legal journalist in a newspaper ?
a36-fragment07_181_7,suggest,1.0,VERB,VB,"IT WAS unfair of Auden to suggest , in his ‘ Letter to Lord Byron ’ , that a poet 's ‘ sense of other people 's very hazy ’ .",IT WAS unfair of Auden to suggest 
a36-fragment07_182_19,appear,0.0,VERB,VB,But the vaporous presences that float through this slender and anaemic first novel by a notable poet would appear to support the claim .,But the vaporous presences that float through this slender and anaemic first novel by a notable poet would appear to support the claim .
a36-fragment07_184_23,offers,0.0,VERB,VBZ,"This , of course , is a popular subject : it seems particularly attractive to the poet-turned-novelist because of the scope it offers for the tremulously sensitive probing of feelings .",is a popular subject : it seems particularly attractive to the poet-turned-novelist because of the scope it offers for the tremulously sensitive probing of feelings .
a36-fragment07_187_8,suffering,0.0,VERB,VBG,"The hero , Francis Mayne , is suffering from the adolescent 's emotional confusion and acute self-consciousness .",is suffering from the adolescent 's emotional confusion and acute self-consciousness .
a36-fragment07_198_4,invaded,0.0,VERB,VBN,It 's been invaded . ’,It 's been invaded . ’
a36-fragment07_199_12,intends,0.0,VERB,VBZ,Motion will have to do better than this if he seriously intends his series of novels to capture the feel of a period .,Motion will have to do better than this if he seriously intends his series of novels to capture the feel of a period .
a36-fragment07_200_7,remains,0.0,VERB,VBZ,But the book 's principal defect remains the vacuity of its protagonist .,But the book 's principal defect remains the vacuity of its protagonist .
a36-fragment07_201_5,depict,0.0,VERB,VB,"In his eagerness to depict the cloudy psychology of an adolescent , Motion has forgotten to give the boy a personality .",In his eagerness to depict the cloudy psychology of an adolescent 
a36-fragment07_201_15,forgotten,0.0,VERB,VBN,"In his eagerness to depict the cloudy psychology of an adolescent , Motion has forgotten to give the boy a personality .",Motion has forgotten to give the boy a personality .
