token_id,query,metaphor,pos,fgpos,sentence,local
clw-fragment01_56_4,undergo,0.0,VERB,VB,"A person may undergo crisis and commitment simultaneously and progress by route A. An alternative is to undergo a period of considerable self-doubt and self-examination in which all one 's beliefs tend to be very fluid , a period known as moratorium , before acquiring beliefs for oneself and ego-identity is achieved ( route B ) .",A person may undergo crisis and commitment simultaneously and progress by route A. An alternative is to undergo a period of considerable self-doubt and self-examination in which all one 's beliefs tend to be very fluid 
clw-fragment01_56_18,undergo,0.0,VERB,VB,"A person may undergo crisis and commitment simultaneously and progress by route A. An alternative is to undergo a period of considerable self-doubt and self-examination in which all one 's beliefs tend to be very fluid , a period known as moratorium , before acquiring beliefs for oneself and ego-identity is achieved ( route B ) .",A person may undergo crisis and commitment simultaneously and progress by route A. An alternative is to undergo a period of considerable self-doubt and self-examination in which all one 's beliefs tend to be very fluid 
clw-fragment01_56_32,tend,0.0,VERB,VBP,"A person may undergo crisis and commitment simultaneously and progress by route A. An alternative is to undergo a period of considerable self-doubt and self-examination in which all one 's beliefs tend to be very fluid , a period known as moratorium , before acquiring beliefs for oneself and ego-identity is achieved ( route B ) .",A person may undergo crisis and commitment simultaneously and progress by route A. An alternative is to undergo a period of considerable self-doubt and self-examination in which all one 's beliefs tend to be very fluid 
clw-fragment01_56_45,acquiring,1.0,VERB,VBG,"A person may undergo crisis and commitment simultaneously and progress by route A. An alternative is to undergo a period of considerable self-doubt and self-examination in which all one 's beliefs tend to be very fluid , a period known as moratorium , before acquiring beliefs for oneself and ego-identity is achieved ( route B ) .",before acquiring beliefs for oneself and ego-identity is achieved ( route B ) .
clw-fragment01_59_7,face,0.0,VERB,VB,"Eventually these persons might have to face up to period of crisis , of self-examination , and so achieve ego-identity by route C. However , foreclosure does offer an escape route and an individual might postpone indefinitely any real self-examination by clinging rigidly to his or her beliefs and values ( route D ) .",Eventually these persons might have to face up to period of crisis 
clw-fragment01_64_3,tend,0.0,VERB,VB,"They will tend to regard the overt expression of emotions , including much such expression in the arts , as being soft and feminine .",They will tend to regard the overt expression of emotions 
clw-fragment01_69_6,tend,0.0,VERB,VB,"Furthermore , these girls will tend to go into a career with a feminine image , one which already attracts many girls .",these girls will tend to go into a career with a feminine image 
clw-fragment01_72_12,concerned,0.0,VERB,VBN,"They are at a stage when they are likely to be concerned with a variety of complex issues ; the meaning of life , the existence of God , ideologies , their emerging sexuality , their future career and life-style — too often science is seen as being purely instrumental with nothing to contribute to these debates .",They are at a stage when they are likely to be concerned with a variety of complex issues ; the meaning of life 
clw-fragment01_72_33,emerging,0.0,VERB,VBG,"They are at a stage when they are likely to be concerned with a variety of complex issues ; the meaning of life , the existence of God , ideologies , their emerging sexuality , their future career and life-style — too often science is seen as being purely instrumental with nothing to contribute to these debates .",their emerging sexuality 
clw-fragment01_72_54,contribute,1.0,VERB,VB,"They are at a stage when they are likely to be concerned with a variety of complex issues ; the meaning of life , the existence of God , ideologies , their emerging sexuality , their future career and life-style — too often science is seen as being purely instrumental with nothing to contribute to these debates .",their future career and life-style — too often science is seen as being purely instrumental with nothing to contribute to these debates .
clw-fragment01_74_13,choose,1.0,VERB,VB,A proportion of both boys and girls at ego-identity achievement stage will choose science .,A proportion of both boys and girls at ego-identity achievement stage will choose science .
clw-fragment01_77_5,explain,1.0,VERB,VB,This model seems to explain our observations .,This model seems to explain our observations .
clw-fragment01_78_29,undergo,0.0,VERB,VBP,"A large number of boys , particularly at the foreclosure stage , are initially attracted to science but there is a drift away throughout later adolescence as they undergo some crisis .",are initially attracted to science but there is a drift away throughout later adolescence as they undergo some crisis .
clw-fragment01_80_10,show,0.0,VERB,VB,The few girls who enter science will not usually show these foreclosure characteristics .,The few girls who enter science will not usually show these foreclosure characteristics .
clw-fragment01_82_25,react,1.0,VERB,VB,The real use of this model linking personality development to subject choice is that it allows us to make predictions about how pupils might react to changes in school science curriculum and school organization .,The real use of this model linking personality development to subject choice is that it allows us to make predictions about how pupils might react to changes in school science curriculum and school organization .
clw-fragment01_85_1,Delaying,0.0,VERB,VBG,Delaying subject choice : Britain is unusual in asking pupils to make crucial choices about subject options in the 13–16 age range .,Delaying subject choice : Britain is unusual in asking pupils to make crucial choices about subject options in the 13–16 age range .
clw-fragment01_90_33,possess,0.0,VERB,VB,"Overall there would be a reduction in the number of students choosing science , but those who do so choose will be more likely to stay happily in the subject and to possess more flexible minds .",but those who do so choose will be more likely to stay happily in the subject and to possess more flexible minds .
clw-fragment01_100_1,Emphasizing,1.0,VERB,VBG,"Emphasizing the applications and relevance of science : To obtain a major qualitative improvement to recruitment in science with more girls and with students possessing imaginative , flexible minds it would be necessary to make science appealing to boys and girls at the moratorium stage .",Emphasizing the applications and relevance of science : To obtain a major qualitative improvement to recruitment in science with more girls and with students possessing imaginative 
clw-fragment01_100_25,possessing,1.0,VERB,VBG,"Emphasizing the applications and relevance of science : To obtain a major qualitative improvement to recruitment in science with more girls and with students possessing imaginative , flexible minds it would be necessary to make science appealing to boys and girls at the moratorium stage .",Emphasizing the applications and relevance of science : To obtain a major qualitative improvement to recruitment in science with more girls and with students possessing imaginative 
clw-fragment01_102_11,presented,1.0,VERB,VBN,The probable implication is that science would need to be presented in the context of the needs of society and individuals .,The probable implication is that science would need to be presented in the context of the needs of society and individuals .
clw-fragment01_105_5,change,1.0,VERB,VB,Is it possible to change school science in this fashion and still preserve the essential character of science itself ?,Is it possible to change school science in this fashion and still preserve the essential character of science itself ?
clw-fragment01_117_20,means,1.0,VERB,VBZ,"Female exclusion from science and technology , even if it is apparently by girls ' own choice , also means that as citizens their ability to understand and control their environment is limited .",also means that as citizens their ability to understand and control their environment is limited .
clw-fragment01_117_29,control,1.0,VERB,VB,"Female exclusion from science and technology , even if it is apparently by girls ' own choice , also means that as citizens their ability to understand and control their environment is limited .",also means that as citizens their ability to understand and control their environment is limited .
clw-fragment01_119_4,ignoring,0.0,VERB,VBG,"In effect , ignoring the effects of gender in this way merely reinforces stereotyping because it does nothing to challenge the definition of certain aspects of the curriculum as masculine or feminine .",ignoring the effects of gender in this way merely reinforces stereotyping because it does nothing to challenge the definition of certain aspects of the curriculum as masculine or feminine .
clw-fragment01_120_50,investigated,1.0,VERB,VBD,"Girls Into Science and Technology ( GIST ) was the first major schools-based project addressing problems of sex stereotyping at school , and was an example of ‘ action research ’ in education ; the project simultaneously took action to improve girls ' achievement in science and technology and investigated the reasons for their under-achievement .",and was an example of ‘ action research ’ in education ; the project simultaneously took action to improve girls ' achievement in science and technology and investigated the reasons for their under-achievement .
clw-fragment01_121_4,collaborated,1.0,VERB,VBD,The project team collaborated with teachers in eight co-educational comprehensive schools in the Greater Manchester area to devise and implement intervention strategies designed to improve girls ' attitudes to the physical sciences and technical subjects .,The project team collaborated with teachers in eight co-educational comprehensive schools in the Greater Manchester area to devise and implement intervention strategies designed to improve girls ' attitudes to the physical sciences and technical subjects .
clw-fragment01_123_24,find,1.0,VERB,VB,The approach was collaborative : teachers were invited to work with the team as equal partners in the attempts both to investigate and find solutions to the GIST problem .,The approach was collaborative : teachers were invited to work with the team as equal partners in the attempts both to investigate and find solutions to the GIST problem .
clw-fragment01_127_15,suggesting,0.0,VERB,VBG,"GIST had more success in altering children 's attitudes than their subject choices , suggesting that it is easier to change attitudes and beliefs than actual behaviour .",suggesting that it is easier to change attitudes and beliefs than actual behaviour .
clw-fragment01_129_17,define,1.0,VERB,VB,They also had slightly more positive attitudes towards science and scientists and were less likely to define them as exclusively masculine .,They also had slightly more positive attitudes towards science and scientists and were less likely to define them as exclusively masculine .
clw-fragment01_132_24,based,1.0,VERB,VBN,"The GIST hypothesis was that female under-achievement in science and technology is at least partly socially constructed by the school , an hypothesis based on research evidence as well as critical feminist analysis ( see , for example , Kelly , 1981 ) .",an hypothesis based on research evidence as well as critical feminist analysis ( see 
clw-fragment01_132_35,see,1.0,VERB,VB,"The GIST hypothesis was that female under-achievement in science and technology is at least partly socially constructed by the school , an hypothesis based on research evidence as well as critical feminist analysis ( see , for example , Kelly , 1981 ) .",an hypothesis based on research evidence as well as critical feminist analysis ( see 
clw-fragment01_134_17,meant,1.0,VERB,VBN,"One of the main gains from the GIST project has been the clarification of what is meant by a ‘ girl friendly ’ , science , that is a science which will appeal equally to the interests and concerns of girls as well as boys . …",One of the main gains from the GIST project has been the clarification of what is meant by a ‘ girl friendly ’ 
clw-fragment01_137_15,changing,1.0,VERB,VBG,"Schools and teachers tried curriculum development to build on girls ' science interests , changing patterns of classroom interaction , single sex groups and classes .",changing patterns of classroom interaction 
clw-fragment01_139_16,offered,0.0,VERB,VBN,"VISTA made science more girl friendly in two ways : both boys and girls were offered an attractive image of a competent woman scientist , and talks concentrated on social and industrial applications of science , an element too often missing from science at school .",VISTA made science more girl friendly in two ways : both boys and girls were offered an attractive image of a competent woman scientist 
clw-fragment01_139_28,concentrated,1.0,VERB,VBD,"VISTA made science more girl friendly in two ways : both boys and girls were offered an attractive image of a competent woman scientist , and talks concentrated on social and industrial applications of science , an element too often missing from science at school .",and talks concentrated on social and industrial applications of science 
clw-fragment01_139_41,missing,0.0,VERB,VBG,"VISTA made science more girl friendly in two ways : both boys and girls were offered an attractive image of a competent woman scientist , and talks concentrated on social and industrial applications of science , an element too often missing from science at school .",an element too often missing from science at school .
clw-fragment01_141_7,helped,1.0,VERB,VBD,"The survey of children 's attitudes helped here : research such as Ormerod 's ( 1971 ; Ormerod and Duckworth , 1975 ) had shown that girls were interested in the social implications of science , but did not tell teachers what the desirable teaching approach might be in practice .",The survey of children 's attitudes helped here : research such as Ormerod 's ( 1971 ; Ormerod and Duckworth 
clw-fragment01_141_40,tell,0.0,VERB,VB,"The survey of children 's attitudes helped here : research such as Ormerod 's ( 1971 ; Ormerod and Duckworth , 1975 ) had shown that girls were interested in the social implications of science , but did not tell teachers what the desirable teaching approach might be in practice .",but did not tell teachers what the desirable teaching approach might be in practice .
clw-fragment01_143_6,asked,1.0,VERB,VBD,"A question from our survey asked children whether they would like to know more about how a vacuum cleaner works ; hardly anyone did , and girls were even less curious than boys .",A question from our survey asked children whether they would like to know more about how a vacuum cleaner works ; hardly anyone did 
clw-fragment01_143_20,works,0.0,VERB,VBZ,"A question from our survey asked children whether they would like to know more about how a vacuum cleaner works ; hardly anyone did , and girls were even less curious than boys .",A question from our survey asked children whether they would like to know more about how a vacuum cleaner works ; hardly anyone did 
clw-fragment01_146_50,appear,0.0,VERB,VB,"Over 50 per cent , and in some cases over 60 per cent said they would like to learn about the human heart , germs and illnesses , how our muscles work , what food is good for you , life in the sea , what makes a rainbow appear and how a record is made .",what makes a rainbow appear and how a record is made .
clw-fragment01_146_56,made,0.0,VERB,VBN,"Over 50 per cent , and in some cases over 60 per cent said they would like to learn about the human heart , germs and illnesses , how our muscles work , what food is good for you , life in the sea , what makes a rainbow appear and how a record is made .",what makes a rainbow appear and how a record is made .
clw-fragment01_150_4,employ,0.0,VERB,VBP,"When women scientists employ such approaches , and describe their own work , as happened during the VISTA programme , girls are receiving double encouragement .",When women scientists employ such approaches 
clw-fragment01_150_23,receiving,0.0,VERB,VBG,"When women scientists employ such approaches , and describe their own work , as happened during the VISTA programme , girls are receiving double encouragement .",girls are receiving double encouragement .
clw-fragment01_151_38,includes,1.0,VERB,VBZ,"These examples indicate some of the features of girl friendly science : it builds on girls ' interests , not just boys ' ; it explicitly encourages girls to see themselves as potential scientists , and it includes some of the social and human implications and applications of science .",and it includes some of the social and human implications and applications of science .
clw-fragment01_154_19,brought,1.0,VERB,VBN,Then certain teachers were particularly struck by the evidence of large differences in the interests and experience children brought with them to school .,Then certain teachers were particularly struck by the evidence of large differences in the interests and experience children brought with them to school .
clw-fragment01_155_25,produced,0.0,VERB,VBN,Girls had far less ‘ tinkering ’ experience than boys and the connection with their lesser interest in topics like ‘ how electricity is produced ’ seemed obvious .,Girls had far less ‘ tinkering ’ experience than boys and the connection with their lesser interest in topics like ‘ how electricity is produced ’ seemed obvious .
clw-fragment01_158_43,removed,1.0,VERB,VBN,"For a more girl friendly science , it seems vital that teachers should come to see that when all the masculine packaging , evident in textbooks and resources as well as teachers ' and boys ' behaviour in the classroom , is removed , girls can be very enthusiastic about science . …",is removed 
clw-fragment01_160_61,embodies,0.0,NOUN,NNS,"First , the pupils , teachers and practitioners of science are overwhelmingly male in terms of numbers ; second , school science is packaged and presented to appeal to boys , not girls ; third , classroom behaviours and interaction operate to reconstruct science as a male activity , and finally it has been suggested that ‘ scientific ’ thinking embodies an intrinsically masculine world view .",and finally it has been suggested that ‘ scientific ’ thinking embodies an intrinsically masculine world view .
clw-fragment01_161_20,redressed,0.0,VERB,VBD,"The GIST interventions described above relate to three of these : VISTA women , albeit briefly and temporarily , redressed the numerical balance by offering female role models of practising scientists ; VISTA and the curriculum development which followed involved a limited ‘ repackaging ’ of science to remove its exclusively masculine appeal , and the single-sex classes and classroom observation showed how science comes to be defined as ‘ masculine ’ in the mixed school .",redressed the numerical balance by offering female role models of practising scientists ; VISTA and the curriculum development which followed involved a limited ‘ repackaging ’ of science to remove its exclusively masculine appeal 
clw-fragment01_161_25,offering,0.0,VERB,VBG,"The GIST interventions described above relate to three of these : VISTA women , albeit briefly and temporarily , redressed the numerical balance by offering female role models of practising scientists ; VISTA and the curriculum development which followed involved a limited ‘ repackaging ’ of science to remove its exclusively masculine appeal , and the single-sex classes and classroom observation showed how science comes to be defined as ‘ masculine ’ in the mixed school .",redressed the numerical balance by offering female role models of practising scientists ; VISTA and the curriculum development which followed involved a limited ‘ repackaging ’ of science to remove its exclusively masculine appeal 
clw-fragment01_161_68,defined,1.0,VERB,VBN,"The GIST interventions described above relate to three of these : VISTA women , albeit briefly and temporarily , redressed the numerical balance by offering female role models of practising scientists ; VISTA and the curriculum development which followed involved a limited ‘ repackaging ’ of science to remove its exclusively masculine appeal , and the single-sex classes and classroom observation showed how science comes to be defined as ‘ masculine ’ in the mixed school .",and the single-sex classes and classroom observation showed how science comes to be defined as ‘ masculine ’ in the mixed school .
clw-fragment01_164_18,meet,1.0,VERB,VBP,"Girls are not uninterested in science , they are bored by the limited version of it they meet in school .",they are bored by the limited version of it they meet in school .
clw-fragment01_166_23,marked,0.0,VERB,VBN,"Margaret Spear , in a different study from the one reported in this volume , found that for identical work boys were marked higher than girls for supposed understanding of principles , aptitude for science and O level suitability ( Spear , 1984 ) .",found that for identical work boys were marked higher than girls for supposed understanding of principles 
cty-fragment03_466_31,suggested,0.0,VERB,VBD,"Citing Marx 's famous remark in The Eighteenth Brumaire , ‘ Men make their own History … but under circumstances … given and transmitted from the past ’ , Sartre suggested that this implied ‘ the permanent and dialectical unity of freedom and necessity , ( I , 35 ) .",Sartre suggested that this implied ‘ the permanent and dialectical unity of freedom and necessity 
cty-fragment03_475_29,determined,0.0,VERB,VBN,"Sartre considered that orthodox dialectical materialism takes the easy way out by merely eliminating the first in favour of the second , making man a passive product entirely determined by economic circumstances .",making man a passive product entirely determined by economic circumstances .
cty-fragment03_477_34,form,0.0,VERB,VBP,"Its corollary , whereby praxis becomes determining history , he called the ‘ practico-inert ’ , by which he meant the material circumstances that have themselves been created by previous praxes and which form the conditions for new praxis .",by which he meant the material circumstances that have themselves been created by previous praxes and which form the conditions for new praxis .
cty-fragment03_479_72,say,1.0,INTJ,UH,"Though this neatly solves the problem of how man can make history while at the same time history makes him , it does not answer the larger question of how a multiplicity of the products of individual acts , ‘ totalizations ’ , can themselves be totalized into the overall totalization required by the logic of dialectical rationality — rather than being the arbitrary , blind and self-cancelling movements of , say , Hardy 's immanent will .",say 
cty-fragment03_480_31,characterized,0.0,VERB,VBN,"Sartre 's fundamental thesis , that ‘ History continually effects totalisations of totalisations ’ ( I , 15 ) , does not in itself answer what Ronald Aronson has rightly characterized as the question for Sartre : ‘ how do separate , antagonistic actions yield a history ; how do individual totalizations lead to Totalization ( and also progress , the direction of history , its truth and its meaning ) ? ’",does not in itself answer what Ronald Aronson has rightly characterized as the question for Sartre : ‘ how do separate 
cty-fragment03_481_52,subsumed,0.0,VERB,VBD,"For the whole basis of Sartre 's argument is that the dialectic of history is not a metaphysical law , ‘ some powerful unitary force revealing itself behind History like the will of God ’ , but the continuously produced effect of individual conflicts ; each action is in its turn subsumed as a part of the whole in an ever broader , developing totalization ( I , 37 ) .",but the continuously produced effect of individual conflicts ; each action is in its turn subsumed as a part of the whole in an ever broader 
cty-fragment03_483_9,creates,0.0,VERB,VBZ,"The dialectic is the law of totalization which creates several collectivities , several societies , and one history — realities , that is , which impose themselves on individuals ; but at the same time it must be woven out of millions of individual actions .",The dialectic is the law of totalization which creates several collectivities 
cty-fragment03_484_25,bring,0.0,VERB,VB,We must show that it is possible for it to be both a resultant … and a totalizing force … how it can continually bring about the unity of dispersive profusion and integration .,We must show that it is possible for it to be both a resultant … and a totalizing force … how it can continually bring about the unity of dispersive profusion and integration .
cty-fragment03_487_6,bring,0.0,VERB,VB,How does it ‘ continually bring about the unity of dispersive profusion and integration ’ ?,How does it ‘ continually bring about the unity of dispersive profusion and integration ’ ?
cty-fragment03_489_7,remains,0.0,VERB,VBZ,The dialectic is the law that remains hidden .,The dialectic is the law that remains hidden .
